{"receipt_id":"rct-demo","contract_id":"k-demo","contract_version":1,"task_id":"t-demo","evidence_commitments":["aaaaaaaaaaaaaaaaaaaaaaaaaaaaaaaaaaaaaaaaaaaaaaaaaaaaaaaaaaaaaaaa"],"obligation_results":[{"obligation_id":"content","state":"true","reason_codes":["CONTENT_MATCH"]}],"verifier_state":{"provider_versions":["model-demo"],"threshold_version":"theta-1","degraded":false},"decision":"accept","transition":{"action":"mark_complete","eligible":true,"decision_id":"d-demo"},"created_at":"2026-08-09T00:01:00Z","appeal_of":null,"decision_id":"d-demo"}
